title;description;url;image
Todo App;A distraction-free web app to help you focus on creating and completing tasks.;https://github.com/MihaiNeagu9/todoapp_web;1.png
Portfolio Website;A website built entirely in Python to showcase coding projects and apps.;https://github.com/MihaiNeagu9/Portofolio_App;2.png
PDF Templates;A script that generates PDF templates of multiple pages given some predefined guidelines.;https://github.com/MihaiNeagu9/PDF_Maker_App;3.png
PDF Invoices;A script that reads invoice records from Excel files and automatically generates PDF invoices.;https://github.com/MihaiNeagu9/Invoice_Generator_App;4.png
Positive News Site;A website that gets data from a news API and uses sentiment analysis to publish only positive news.;https://github.com/MihaiNeagu9/NewsAPI_Email_App;5.png